{
  "schema_version": "1.0",
  "snapshot_id": "sha256:BB0D9E1A3C01D452DFE709D4866C0B8C952C042582533B05270E7BCF3CDCE326",
  "generated_at_utc": "2026-07-15T09:55:00Z",
  "events": [
    {
      "event_id": "EV-0001",
      "occurred_at_utc": "2026-07-07T00:00:00Z",
      "recorded_at_utc": "2026-07-07T00:00:00Z",
      "phase_id": "PHASE_00",
      "gate_id": "00-GOVERNANCE",
      "event_type": "GATE_COMPLETED",
      "status": "COMPLETED",
      "outcome": "PASS",
      "classification": "PROJECT_GOVERNANCE_INITIALIZED",
      "summary": "FleetVision root, architecture and Git governance established.",
      "git_checkpoint": null,
      "test_summary": {
        "focused": null,
        "regression": null,
        "full": null,
        "skipped": 0,
        "failed": 0
      },
      "evidence_ids": [],
      "safety_snapshot": {
        "TEST_SPLIT_READ": "NO",
        "MODEL_INFERENCE_EXECUTED": "NO",
        "CANONICAL_COCO_MODIFIED": "NO",
        "DATASET_MODIFIED": "NO",
        "REGISTRY_MODIFIED": "NO",
        "FIXED_SPLITS_MODIFIED": "NO",
        "TRAINING_STARTED": "NO"
      },
      "trust_level": "REPOSITORY_VERIFIED",
      "source_refs": [
        {
          "type": "repository_file",
          "path": "docs/00_project_management/MASTER_PHASE_MAP.md",
          "ref": "374b2b99b997810da3e3c2beac0d7174df7c0e5f",
          "section": "Phase map"
        }
      ],
      "corrects_event_id": null
    },
    {
      "event_id": "EV-0002",
      "occurred_at_utc": "2026-07-09T00:00:00Z",
      "recorded_at_utc": "2026-07-09T00:00:00Z",
      "phase_id": "PHASE_01",
      "gate_id": "01-METADATA",
      "event_type": "GATE_COMPLETED",
      "status": "COMPLETED",
      "outcome": "PASS",
      "classification": "METADATA_CATALOG_COMPLETED",
      "summary": "Metadata catalog completed without modifying raw data.",
      "git_checkpoint": null,
      "test_summary": {
        "focused": null,
        "regression": null,
        "full": null,
        "skipped": 0,
        "failed": 0
      },
      "evidence_ids": [],
      "safety_snapshot": {
        "TEST_SPLIT_READ": "NO",
        "MODEL_INFERENCE_EXECUTED": "NO",
        "CANONICAL_COCO_MODIFIED": "NO",
        "DATASET_MODIFIED": "NO",
        "REGISTRY_MODIFIED": "NO",
        "FIXED_SPLITS_MODIFIED": "NO",
        "TRAINING_STARTED": "NO"
      },
      "trust_level": "REPOSITORY_VERIFIED",
      "source_refs": [
        {
          "type": "repository_file",
          "path": "docs/00_project_management/MASTER_PHASE_MAP.md",
          "ref": "374b2b99b997810da3e3c2beac0d7174df7c0e5f",
          "section": "Phase map"
        }
      ],
      "corrects_event_id": null
    },
    {
      "event_id": "EV-0003",
      "occurred_at_utc": "2026-07-09T12:00:00Z",
      "recorded_at_utc": "2026-07-09T12:00:00Z",
      "phase_id": "PHASE_02",
      "gate_id": "02-REVIEW-QUEUE",
      "event_type": "GATE_COMPLETED",
      "status": "COMPLETED",
      "outcome": "PASS",
      "classification": "REVIEW_QUEUE_COMPLETED",
      "summary": "Review queue and identity preservation completed.",
      "git_checkpoint": null,
      "test_summary": {
        "focused": null,
        "regression": null,
        "full": null,
        "skipped": 0,
        "failed": 0
      },
      "evidence_ids": [],
      "safety_snapshot": {
        "TEST_SPLIT_READ": "NO",
        "MODEL_INFERENCE_EXECUTED": "NO",
        "CANONICAL_COCO_MODIFIED": "NO",
        "DATASET_MODIFIED": "NO",
        "REGISTRY_MODIFIED": "NO",
        "FIXED_SPLITS_MODIFIED": "NO",
        "TRAINING_STARTED": "NO"
      },
      "trust_level": "REPOSITORY_VERIFIED",
      "source_refs": [
        {
          "type": "repository_file",
          "path": "docs/00_project_management/MASTER_PHASE_MAP.md",
          "ref": "374b2b99b997810da3e3c2beac0d7174df7c0e5f",
          "section": "Phase map"
        }
      ],
      "corrects_event_id": null
    },
    {
      "event_id": "EV-0004",
      "occurred_at_utc": "2026-07-10T00:00:00Z",
      "recorded_at_utc": "2026-07-10T00:00:00Z",
      "phase_id": "PHASE_03",
      "gate_id": "03-SCHEMA-VALIDATOR",
      "event_type": "GATE_COMPLETED",
      "status": "COMPLETED",
      "outcome": "PASS",
      "classification": "HUMAN_REVIEW_SCHEMA_VALIDATED",
      "summary": "Human review schema and validator completed.",
      "git_checkpoint": null,
      "test_summary": {
        "focused": null,
        "regression": null,
        "full": null,
        "skipped": 0,
        "failed": 0
      },
      "evidence_ids": [],
      "safety_snapshot": {
        "TEST_SPLIT_READ": "NO",
        "MODEL_INFERENCE_EXECUTED": "NO",
        "CANONICAL_COCO_MODIFIED": "NO",
        "DATASET_MODIFIED": "NO",
        "REGISTRY_MODIFIED": "NO",
        "FIXED_SPLITS_MODIFIED": "NO",
        "TRAINING_STARTED": "NO"
      },
      "trust_level": "REPOSITORY_VERIFIED",
      "source_refs": [
        {
          "type": "repository_file",
          "path": "docs/00_project_management/MASTER_PHASE_MAP.md",
          "ref": "374b2b99b997810da3e3c2beac0d7174df7c0e5f",
          "section": "Phase map"
        }
      ],
      "corrects_event_id": null
    },
    {
      "event_id": "EV-0005",
      "occurred_at_utc": "2026-07-10T12:00:00Z",
      "recorded_at_utc": "2026-07-10T12:00:00Z",
      "phase_id": "PHASE_03_5",
      "gate_id": "03.5-AUTO-PRELABEL",
      "event_type": "GATE_COMPLETED",
      "status": "FROZEN",
      "outcome": "PASS",
      "classification": "AUTO_PRELABEL_PILOT_COMPLETED_AND_FROZEN",
      "summary": "Auto prelabel pilot completed and inference frozen.",
      "git_checkpoint": null,
      "test_summary": {
        "focused": null,
        "regression": null,
        "full": null,
        "skipped": 0,
        "failed": 0
      },
      "evidence_ids": [],
      "safety_snapshot": {
        "TEST_SPLIT_READ": "NO",
        "MODEL_INFERENCE_EXECUTED": "NO",
        "CANONICAL_COCO_MODIFIED": "NO",
        "DATASET_MODIFIED": "NO",
        "REGISTRY_MODIFIED": "NO",
        "FIXED_SPLITS_MODIFIED": "NO",
        "TRAINING_STARTED": "NO"
      },
      "trust_level": "REPOSITORY_VERIFIED",
      "source_refs": [
        {
          "type": "repository_file",
          "path": "docs/00_project_management/MASTER_PHASE_MAP.md",
          "ref": "374b2b99b997810da3e3c2beac0d7174df7c0e5f",
          "section": "Phase map"
        }
      ],
      "corrects_event_id": null
    },
    {
      "event_id": "EV-0006",
      "occurred_at_utc": "2026-07-12T01:10:49Z",
      "recorded_at_utc": "2026-07-12T01:10:49Z",
      "phase_id": "PHASE_04",
      "gate_id": "04E",
      "event_type": "GATE_COMPLETED",
      "status": "COMPLETED",
      "outcome": "PASS",
      "classification": "REVIEWED_DATASET_BUILD_VERIFIED",
      "summary": "Pilot 500 merge, schema promotion and reviewed dataset build completed.",
      "git_checkpoint": null,
      "test_summary": {
        "focused": null,
        "regression": null,
        "full": null,
        "skipped": 0,
        "failed": 0
      },
      "evidence_ids": [
        "E-PHASE04-CHECKPOINT"
      ],
      "safety_snapshot": {
        "TEST_SPLIT_READ": "NO",
        "MODEL_INFERENCE_EXECUTED": "NO",
        "CANONICAL_COCO_MODIFIED": "NO",
        "DATASET_MODIFIED": "NO",
        "REGISTRY_MODIFIED": "NO",
        "FIXED_SPLITS_MODIFIED": "NO",
        "TRAINING_STARTED": "NO"
      },
      "trust_level": "REPOSITORY_VERIFIED",
      "source_refs": [
        {
          "type": "repository_file",
          "path": "docs/00_project_management/PROJECT_STATUS.md",
          "ref": "374b2b99b997810da3e3c2beac0d7174df7c0e5f",
          "section": "Controlling addenda"
        }
      ],
      "corrects_event_id": null
    },
    {
      "event_id": "EV-0007",
      "occurred_at_utc": "2026-07-12T12:00:00Z",
      "recorded_at_utc": "2026-07-12T12:00:00Z",
      "phase_id": "PHASE_04_5",
      "gate_id": "04.5F",
      "event_type": "GATE_COMPLETED",
      "status": "COMPLETED",
      "outcome": "PASS",
      "classification": "ANNOTATION_QA_STRUCTURALLY_READY_FOR_TARGETED_VISUAL_REVIEW",
      "summary": "External data deduplication, group-safe planning and canonical COCO structural QA completed.",
      "git_checkpoint": null,
      "test_summary": {
        "focused": null,
        "regression": null,
        "full": null,
        "skipped": 0,
        "failed": 0
      },
      "evidence_ids": [],
      "safety_snapshot": {
        "TEST_SPLIT_READ": "NO",
        "MODEL_INFERENCE_EXECUTED": "NO",
        "CANONICAL_COCO_MODIFIED": "NO",
        "DATASET_MODIFIED": "NO",
        "REGISTRY_MODIFIED": "NO",
        "FIXED_SPLITS_MODIFIED": "NO",
        "TRAINING_STARTED": "NO"
      },
      "trust_level": "REPOSITORY_VERIFIED",
      "source_refs": [
        {
          "type": "repository_file",
          "path": "docs/00_project_management/MASTER_PHASE_MAP.md",
          "ref": "374b2b99b997810da3e3c2beac0d7174df7c0e5f",
          "section": "Phase map"
        }
      ],
      "corrects_event_id": null
    },
    {
      "event_id": "EV-0008",
      "occurred_at_utc": "2026-07-13T08:28:57Z",
      "recorded_at_utc": "2026-07-13T08:28:57Z",
      "phase_id": "PHASE_04_5",
      "gate_id": "04.5J",
      "event_type": "GATE_COMPLETED",
      "status": "COMPLETED",
      "outcome": "PASS",
      "classification": "CONTROLLED_COLAB_BASELINE_TRAINING_COMPLETED",
      "summary": "Controlled YOLOv8s baseline training completed.",
      "git_checkpoint": "0fa698a21be5fcc737fe4b000364cdccd743ec5f",
      "test_summary": {
        "focused": null,
        "regression": null,
        "full": null,
        "skipped": 0,
        "failed": 0
      },
      "evidence_ids": [
        "E-04.5J-ZIP"
      ],
      "safety_snapshot": {
        "TEST_SPLIT_READ": "NO",
        "MODEL_INFERENCE_EXECUTED": "NO",
        "CANONICAL_COCO_MODIFIED": "NO",
        "DATASET_MODIFIED": "NO",
        "REGISTRY_MODIFIED": "NO",